{
  "$schema": "urn:nexilb:schema:catalog-descriptor:0.2",
  "descriptor_schema_version": {"major": 0, "minor": 2},
  "entity_id": "chain.nexilb.native",
  "kind": {"id": "model_chain", "code": 14},
  "descriptor_revision": {"major": 0, "minor": 2},
  "public_name": "NexiLB native model entries",
  "summary": "Catalog group for the two native NexiLB model entries; models are created by their individual IDs rather than through the group ID.",
  "visibility": "public",
  "scope": "library_static",
  "status": {
    "contract": "runtime_contract",
    "implementation": "present_in_controlled_runtime",
    "runtime": "available_with_compatible_runtime",
    "verification": "covered_by_cuda_runtime_tests"
  },
  "availability_reason_id": "status.controlled_runtime.available",
  "schema_ref": {"state": "runtime_descriptor_schema_available"},
  "relations": [
    {"relation_id": "parallel_with", "target_id": "chain.NPhaseContactAngle"},
    {"relation_id": "parallel_with", "target_id": "chain.NPhaseImbDemContactAngle"}
  ],
  "blocking_requirement_ids": [],
  "evidence_ids": [
    "test.runtime.dynamic_load",
    "test.runtime.imb_capillary_relaxation",
    "test.runtime.imb_sinking_cylinder",
    "test.runtime.imb_three_particle_assembly"
  ],
  "payload": {
    "member_inventory_state": "complete_for_contract",
    "members": [
      "model.nexilb.NSAllen",
      "model.nexilb.NSAllenImbPrescribedMotion"
    ]
  }
}
